{"schemaVersion":"uniclaw.workspace.capability.v1","contractVersion":"uniclaw.workspace.contract.v1","capability":"TaskQuery","capabilityVersion":"v1","requestId":"req-success","ok":true,"data":{"projects":[],"errors":[]},"snapshotId":"snap-002","revision":7,"observedAt":"2026-10-02T10:00:00Z","productSessionId":"ps-001"}
